http://realec.org/index.xhtml#/exam/exam2017_6/OBy_21_2; Category_confusion;  We should reduce using toxic material, reduce some things and not pollute water and air by making new high-teck gadgets.; using; the use of
http://realec.org/index.xhtml#/exam/exam2017_6/OBy_21_2; Category_confusion; 

In conclusion, it is useful to restate that our healthy is under our control and we are able to use new technology in order to protect ourselves, not destroy our well being.; healthy; health
http://realec.org/index.xhtml#/exam/exam2017_6/OBy_59_2; Category_confusion;  For example, it is very hard to keep an attention on work, when mobile noties interrupt in your work process, it leads to increasing level of anxiety.; work; working
http://realec.org/index.xhtml#/exam/exam2017_6/NMya_3_2; Category_confusion;  As for me, teachers can help – they are able to discuss with their students different aspects of life, show that everyone can earn his living in a law way.; law; legal
http://realec.org/index.xhtml#/exam/exam2017_6/NMya_3_2; Category_confusion;  Their also can organize any group activities – teachers and students are able to grow vegetables together (and help hungry students, who can’t eat normally at home), clean school’s yard, go in for sport, do any projects – about science and society.; sport; sports
http://realec.org/index.xhtml#/exam/exam2017_6/NMya_3_2; Category_confusion;  These young people are usually drug addicted.; addicted; addicts
http://realec.org/index.xhtml#/exam/exam2017_6/OBy_135_1; Category_confusion;  

Overall, the both lines of the first graph is riching pick stedialy and slowly falling down in contrast of the second graph that have not considerable changing from one temperature for the period.; changing; changes
http://realec.org/index.xhtml#/exam/exam2017_6/OBy_156_2; Category_confusion;  Ideal country for these people it are may cities and manufactories, when developing each product of our everyday ration for breakfast and dinner.; developing; developed
http://realec.org/index.xhtml#/exam/exam2017_6/OBy_156_2; Category_confusion;  Because process of change resources is one of the most important for each government.; change; changing
http://realec.org/index.xhtml#/exam/exam2017_6/OBy_156_2; Category_confusion;  I think, that each country should use as own products as import resources.; import; imported
http://realec.org/index.xhtml#/exam/exam2017_6/OBy_19_1; Category_confusion;  

Looking at the detail, machinery goods accounted for only 2 per cent of all transported goods by road and it is the least number of at all.; at the detail; more detaily
http://realec.org/index.xhtml#/exam/exam2017_6/OBy_24_1; Category_confusion; The pie charts below provide data on transporting of products in countries of Eastern Europe over the 2008 year.; transporting; the transportation
http://realec.org/index.xhtml#/exam/exam2017_6/OBy_24_1; Category_confusion;  The pie chart, related with transporting by road, demonstrates that the most significant proportion is food products that is about 30% of total quantity of goods.; transporting; transported
http://realec.org/index.xhtml#/exam/exam2017_6/EGe_264_2; Category_confusion;  People have a habitat to use it unstopable.; unstopable; unstoppably
http://realec.org/index.xhtml#/exam/exam2017_6/EGe_264_2; Category_confusion;  Moreover, such type of transport often is more comfortable and safe, so people can feel calm and peace in it.; peace; peaceful
http://realec.org/index.xhtml#/exam/exam2017_6/KTR_18_2; Category_confusion;  And that is why the USSR was the greatest country in the world with ideal economic.; economic; economy
http://realec.org/index.xhtml#/exam/exam2017_6/KTR_18_2; Category_confusion;  Exactly that is why a lot of people haven’t job and the Russia economic on the bottom.; the Russia economic; Russian economy
http://realec.org/index.xhtml#/exam/exam2017_6/KTR_18_2; Category_confusion;  But if the government do something to change it, do something to less impor, our economic will get the second life.; economic; economy
http://realec.org/index.xhtml#/exam/exam2017_6/KTR_18_2; Category_confusion;  It’s save the economic of country and create the work places for people.; economic; economy
http://realec.org/index.xhtml#/exam/exam2017_6/KTR_18_2; Category_confusion;  It’s save the economic of country and create the work places for people.; places; placements
http://realec.org/index.xhtml#/exam/exam2017_6/EGe_266_1; Category_confusion; 
Manufactured goods are among the most transported as well as at the first pie chart and almost equals its per centage.; almost equals; and is almost equal to
http://realec.org/index.xhtml#/exam/exam2017_6/OBy_26_2; Category_confusion;  Other wide spreaded problem refers to mental diseas.; spreaded; spread
http://realec.org/index.xhtml#/exam/exam2017_6/OBy_169_1; Category_confusion;  There is also a significant difference in transporting machinery (it is mostly transported by rail) and food products (in contrast it is mostly transported by road).; transporting; the transportation of
http://realec.org/index.xhtml#/exam/exam2017_6/OBy_172_2; Category_confusion;  If parents would force their children to only needed use of computers it would safe their eyes from a big amount of radiation.; safe; save
http://realec.org/index.xhtml#/exam/exam2017_6/NMya_4_2; Category_confusion;  Government, public services are still unfamiliar with internet, it is often uneasy for old people to learn how to use it in full potential.; it; its
http://realec.org/index.xhtml#/exam/exam2017_6/OBy_78_1; Category_confusion; According to a chart we can get the information about goods: first we can see the frequently transported goods but each sphere.; but; in
http://realec.org/index.xhtml#/exam/exam2017_6/OBy_85_1; Category_confusion; The chart below representing information about yearly changing of unemployment rate in selected worlds regions from 2014 to 2015.; changing; changes
http://realec.org/index.xhtml#/exam/exam2017_6/NMya_6_2; Category_confusion; 
However the learning moral aspect is not enough.; the learning; learning
http://realec.org/index.xhtml#/exam/exam2017_6/EGe_264_1; Category_confusion;  Differents between minimum and maximum temperatures are approximately 10 degrees in Brazil and go from 5 to 10 degrees in Russia in each month.; Differents; Difference
http://realec.org/index.xhtml#/exam/exam2017_6/OBy_61_2; Category_confusion;  That’s about medicine that reduce the problem those appear connect with modern technology.; connect; connected
http://realec.org/index.xhtml#/exam/exam2017_6/OBy_24_2; Category_confusion; It is certainty true that nowadays there is a problem relating with influence of modern technologies on quantity of problems with health.; relating; related
http://realec.org/index.xhtml#/exam/exam2017_6/OBy_108_2; Category_confusion;  Of course, these are not essential human needs, but in modern world, where media surrounds society and every individual, it is difficult to resist on psychological level – person feels need in staying tuned.; feels need in staying; needs to stay
http://realec.org/index.xhtml#/exam/exam2017_6/OBy_26_1; Category_confusion; The pie charts illustrates proportion of goods transported by rail and road in 2008 in the East part of Europe.; East; Eastern
http://realec.org/index.xhtml#/exam/exam2017_6/OBy_63_1; Category_confusion;  So clear that metals possible transported by rail and by road, but food products better transported by road, although metals better transopt by rai.; transopt; transported
http://realec.org/index.xhtml#/exam/exam2017_6/OBy_172_1; Category_confusion;  The percentage of chemicals delivered to the buyers by road transport was on5% bigger than transportation by rail.; transportation; transported
http://realec.org/index.xhtml#/exam/exam2017_6/OBy_154_2; Category_confusion; 

Secondly, importing food can be beneficial for country’s economy in the ways that might not be obvious For example, if a country is producing too much of a certain article of food, it can export the overhead and as such compensate  for the possible economical damage of importing other kinds food required for the healthy diet of an average citizen, whereas if not for importing food the economy would stagnate pretty quick.; quick; quickly
http://realec.org/index.xhtml#/exam/exam2017_6/OBy_154_2; Category_confusion;  

To sum up, I think importing is not necessarily a bad thing, because diversity in food is beneficial for the population’s health and also importing allows for exporting overheads and not worrying about starving the population.; importing; import
http://realec.org/index.xhtml#/exam/exam2017_6/OBy_154_2; Category_confusion;  

To sum up, I think importing is not necessarily a bad thing, because diversity in food is beneficial for the population’s health and also importing allows for exporting overheads and not worrying about starving the population.; importing; import
http://realec.org/index.xhtml#/exam/exam2017_6/OBy_111_2; Category_confusion;  However, conscientious, pirates  should be punished because they do a serious act of crime.; conscientious; conscientiously
http://realec.org/index.xhtml#/exam/exam2017_6/OBy_78_2; Category_confusion; It is commonly agreed that frequently used new technology increasing variety of heath issues.; frequently used; the frequent use
http://realec.org/index.xhtml#/exam/exam2017_6/OBy_78_2; Category_confusion;  Also if you spend too much time sitting by the TV or playing games, or working on computer can cause you decreasing your eyes health and even damage them so much that you can lose your focus.; decreasing; the decrease
http://realec.org/index.xhtml#/exam/exam2017_6/OBy_78_2; Category_confusion;  So  because of my time spent on the computer today I frequently have a headache, my vision is blurred, I’m always on nerves, can’t barely calm down, sometimes I loosing the words, that I tried to say because I easily loosing my concentrate.; concentrate; concentration
http://realec.org/index.xhtml#/exam/exam2017_6/OBy_81_2; Category_confusion; Nowadays there is almost nothing impossible thankful to modern technology.; thankful; thanks
http://realec.org/index.xhtml#/exam/exam2017_6/KTR_8_1; Category_confusion;  facebook gets the first place among this networks because it is firstly invited
.; firstly; the first to be
http://realec.org/index.xhtml#/exam/exam2017_6/OBy_150_2; Category_confusion; That is really hard question for people to organize economical in their countries.; economical; economics
http://realec.org/index.xhtml#/exam/exam2017_6/OBy_150_2; Category_confusion;  That solve another problem, which called unemployed.; unemployed; unemployment
http://realec.org/index.xhtml#/exam/exam2017_6/OBy_150_2; Category_confusion;  My version of organization food politics is decreasing import as possible and increasing export.; politics; policy
http://realec.org/index.xhtml#/exam/exam2017_6/OBy_115_2; Category_confusion; As a standard of living continue to rise, new technologies develop actively.; living; life
http://realec.org/index.xhtml#/exam/exam2017_6/OBy_174_2; Category_confusion;  

Initially, nowadays people become overweight because they do not spend much time outdoors but relax or even communicate with their friends through the Internet using various social networks.; overweight; overweighted
http://realec.org/index.xhtml#/exam/exam2017_6/OBy_174_2; Category_confusion;  Secondly, people may reduce the time they spend in social networks in order not to become overweight.; overweight; overweighted
http://realec.org/index.xhtml#/exam/exam2017_6/OBy_149_2; Category_confusion;  I am disagree with this statement and I will try to explain why.; am disagree; 
http://realec.org/index.xhtml#/exam/exam2017_6/OBy_98_2; Category_confusion;  

Downloading, copying and sharing pirate copies of music or films is not the worth criminal in the world and that is why I consider that it does not deserve a punishment.; criminal; crime
http://realec.org/index.xhtml#/exam/exam2017_6/OBy_43_1; Category_confusion;  By the way, transporting food by the road is more popular than transporting it by rail (30% to 10%).; transporting; transported
http://realec.org/index.xhtml#/exam/exam2017_6/OBy_43_1; Category_confusion;  By the way, transporting food by the road is more popular than transporting it by rail (30% to 10%).; transporting; transported
http://realec.org/index.xhtml#/exam/exam2017_6/OBy_43_1; Category_confusion;  In other categories, there is same percent, except metal, 35% of all road transporting system are remove metals from place to place.; transporting; transported
http://realec.org/index.xhtml#/exam/exam2017_6/OBy_43_1; Category_confusion; 

Well, we can summarise then that heave things like metal are transporting by rails, and light things like food and manufactured goods are transporting by road.; transporting; transported
http://realec.org/index.xhtml#/exam/exam2017_6/NMya_31_1; Category_confusion;  Middle aged groups (30 - 49, 50 - 64) are the most prominent in this social network, while general leader group (18 - 29) demonstrates the lowest participation rate.; general; generally
http://realec.org/index.xhtml#/exam/exam2017_6/NMya_31_1; Category_confusion;  Middle aged groups (30 - 49, 50 - 64) are the most prominent in this social network, while general leader group (18 - 29) demonstrates the lowest participation rate.; leader; leading
http://realec.org/index.xhtml#/exam/exam2017_6/OBy_41_1; Category_confusion;  As manufactured goods, chemical had equal percent transported (16% and 11%).; transported; in the transportations
http://realec.org/index.xhtml#/exam/exam2017_6/OBy_41_1; Category_confusion;  This different in 10% was huge for this system.; different; difference
http://realec.org/index.xhtml#/exam/exam2017_6/OBy_67_2; Category_confusion; 

The increased these health problems we are witnessing today could be caused by a number of reasons.; increased; increase
http://realec.org/index.xhtml#/exam/exam2017_6/NMya_28_2; Category_confusion;  Crime is not only a much easier way for young people if we speak about non-violent crime, but also an act of commiting the crime becomes unaccepted for people.; unaccepted; unacceptable
http://realec.org/index.xhtml#/exam/exam2017_6/NMya_28_2; Category_confusion;  And working fair becomes harder and harder for young, especially just graduated, people as they can't find a job that suits them due to the lack of experience.; fair; fairly
http://realec.org/index.xhtml#/exam/exam2017_6/NMya_28_2; Category_confusion;  Young people, especially children and teenagers, watch a lot of films where criminals are such said "cool guys": rich, loved by women and sometime even acting better, than police itself.; sometime; sometimes
http://realec.org/index.xhtml#/exam/exam2017_6/OBy_115_1; Category_confusion;  

Firstly, it is obviously that the unemployment rate in South Asia, North Asia and Worlwide are in the level off.; obviously; obvious
http://realec.org/index.xhtml#/exam/exam2017_6/OBy_150_1; Category_confusion;  

Summarising the information, there is a hug difference between Yakutsk, Russia and Rio de Janeiro, Brazil, when completely half of the year temperature in Yakutsk is under o*C, while the minimum temperature in Rio is 17*C.; minimum; minimal
http://realec.org/index.xhtml#/exam/exam2017_6/KTR_21_2; Category_confusion;  Despite the fact that modern tehnics make our lives easier, they can also create sone serious healthissues.; tehnics; technologies
http://realec.org/index.xhtml#/exam/exam2017_6/KTR_21_2; Category_confusion;  For example, office worker's job is conneted to PC usement.; usement; using
http://realec.org/index.xhtml#/exam/exam2017_6/KTR_21_2; Category_confusion;  Neither litle kid nor adult is able to exist comfortable without technics.; comfortable; comfortably
http://realec.org/index.xhtml#/exam/exam2017_6/OBy_83_2; Category_confusion;  So it is very necessary have acses to import food as soon as to own.; import; imported
http://realec.org/index.xhtml#/exam/exam2017_6/OBy_174_1; Category_confusion;  However, chemicals in two types of delivering goods took approximately the same position with 11 and 16 percent each.; delivering; delivered
http://realec.org/index.xhtml#/exam/exam2017_6/OBy_117_2; Category_confusion;  Therefore, relasing piracy copies and downloading creators works for free form left online pages brings a great harm and even may prevent a future best products from occurring since creators are lost in the previous one and have no intentions to generate another one.; piracy; pirate
http://realec.org/index.xhtml#/exam/exam2017_6/NMya_31_2; Category_confusion;  To me, it is developing technology that lead to the feeling of lesser crime responsibility, thus youngsters are not afraid of punishment any more.; lesser; less
http://realec.org/index.xhtml#/exam/exam2017_6/OBy_20_1; Category_confusion;  There was relatively change.; relatively; relative
http://realec.org/index.xhtml#/exam/exam2017_6/OBy_9_1; Category_confusion; 

To sum up, I would like to say that the most transported good are manufactury (53%).; manufactury; manufactured goods
http://realec.org/index.xhtml#/exam/exam2017_7/VSa_86_1; Category_confusion; This bar chart demonstrates statistics and analitics information on the print and eBook market in four countries in 2014 with a prognose for 2018.; statistics; statistic
http://realec.org/index.xhtml#/exam/exam2017_7/VSa_86_1; Category_confusion; This bar chart demonstrates statistics and analitics information on the print and eBook market in four countries in 2014 with a prognose for 2018.; analitics; analytic
http://realec.org/index.xhtml#/exam/exam2017_7/VSa_86_1; Category_confusion;  For example, China is country with the highest population, but is doesn't provides numbers of chart be also the greatest.; be; being
http://realec.org/index.xhtml#/exam/exam2017_7/VSa_86_1; Category_confusion;  For example, in Germany print books' level remains stable, while the eBooks' is rising.; print; printed
http://realec.org/index.xhtml#/exam/exam2017_7/VSa_84_2; Category_confusion;  Sport is not just about always being first; it teaches to strive some strict moral codex and being honour with yourself.; honour; honest
http://realec.org/index.xhtml#/exam/exam2017_7/VSa_84_2; Category_confusion;  In this case how can such person call himself a truly sportsmen.; truly; true
http://realec.org/index.xhtml#/exam/exam2017_7/VSa_46_2; Category_confusion;  Individual approach is necessity in every issue that affects human-beings.; necessity; necessary
http://realec.org/index.xhtml#/exam/exam2017_7/VSa_60_1; Category_confusion; The illustrate demonstrates a significant datum about development of the market between four states.; illustrate; illustration
http://realec.org/index.xhtml#/exam/exam2017_7/OBy_185_2; Category_confusion;  Secondly, the government should subsidized the companies which are produce less harmful and dangerous technologies.; subsidized; subsidize
http://realec.org/index.xhtml#/exam/exam2017_7/OBy_178_2; Category_confusion;  For instance, nearly 30% of all people are overweight and the majority of them is due to often  use of cars and computers.; overweight; overweighted
http://realec.org/index.xhtml#/exam/exam2017_7/VSa_86_2; Category_confusion;  And it is very difficult, perhaps, even impossible to determine, whether it was a sportsman's desire, or a government pressing.; pressing; pressure
http://realec.org/index.xhtml#/exam/exam2017_7/VSa_84_1; Category_confusion;  Overall, it can be seen that there is a permanent increasing in development eBook market, while the interest to the print books is decreased during that time.; print; printed
http://realec.org/index.xhtml#/exam/exam2017_7/VSa_79_1; Category_confusion;  Overall amount of print books sold in three of four countries is expected to decrease, while the amount of eBooks sold is going to increase in every case.; print; printed
http://realec.org/index.xhtml#/exam/exam2017_7/OBy_183_1; Category_confusion;  

All in all, the main differences, comparing rail and road transportation, are the proportion of metal and machinery which the highest in railway method, and percentage of food products, delivering by tracks.; delivering; delivered 
http://realec.org/index.xhtml#/exam/exam2017_7/OBy_198_2; Category_confusion; Majority of people think that the main cause of increasing number of diseases is the overusing the technology.; overusing; overuse
http://realec.org/index.xhtml#/exam/exam2017_7/VSa_42_2; Category_confusion;  That is Why it is important to know and remember about side-effects of modern devices and tools because they have bad impact on humanity health.; humanity; human
http://realec.org/index.xhtml#/exam/exam2017_7/VSa_42_2; Category_confusion;  This is undoubtly a great advantage for people in fast changing modern world.; undoubtly; undoubtedly
http://realec.org/index.xhtml#/exam/exam2017_7/VSa_42_2; Category_confusion;  By the reason of constant using of modern devices many people have headaches, can see badly and may have a lot of other deseases.; using; use
http://realec.org/index.xhtml#/exam/exam2017_7/OBy_181_2; Category_confusion;  But the influence on human consuming such produce and animal meat is not studied yet.; produce; products
http://realec.org/index.xhtml#/exam/exam2017_7/VSa_6_1; Category_confusion;  Manu factured goods and machinery are less popular for transported by rail, and they shows only 25% and 12% respectevely.; transported; transportation
http://realec.org/index.xhtml#/exam/exam2017_7/VSa_104_1; Category_confusion; 
The most common feature of this chart is the growing of a e-Book part of market in all countries from 2014 to 2018.; growing; 
http://realec.org/index.xhtml#/exam/exam2017_7/VSa_104_1; Category_confusion;  The growing of e-Book part will pass in different ways in this countries, while the market of USA will grow significantly (from 5,5 to 8,5) the Germany's one will gain 0,6 only.; growing; growth
http://realec.org/index.xhtml#/exam/exam2017_7/VSa_40_2; Category_confusion;  One of the most striking features of this problem that a lot of people aware the fact that modern technology are known to be dangerous for their health, but continue to use it in the daily routine and very often.; aware; are aware of
http://realec.org/index.xhtml#/exam/exam2017_7/VSa_82_1; Category_confusion; 
In the USA, the sales of print books are forecast to fall from 10,5 to 7,5 billion dollars, whereas the sales of electronic ones are predicted to rise from 5,5 to 8,5 billion dollars.; print; printed
http://realec.org/index.xhtml#/exam/exam2017_7/VSa_4_2; Category_confusion; 
What is needed to improve the situation with widespread using of gadjets is definite action should be encouraged and promoted by means of avoiding them.; using; use
http://realec.org/index.xhtml#/exam/exam2017_7/VSa_19_1; Category_confusion; 
In the second chart there are goods, for example, food products and manufactured goods are prevalence.; prevalence; prevalent
http://realec.org/index.xhtml#/exam/exam2017_7/VSa_61_1; Category_confusion;  The same situation will be in 2018 (the USA - 7,5, the UK - 2, Germany - 6, China - 4,2) even though there will be a decrease in numbers except Germany where there will be the stabilization.; the stabilization; 
http://realec.org/index.xhtml#/exam/exam2017_7/OBy_200_2; Category_confusion;  

All in all, it is clear that the widespread use of modern technology do cause an increase trend in health problems.; increase; increasing
http://realec.org/index.xhtml#/exam/exam2017_7/OBy_186_1; Category_confusion;  Overall, the proportion of goods transported by railroad is marginally differ from proportion of products supplied by road.; differ; different
http://realec.org/index.xhtml#/exam/exam2017_7/VSa_1_2; Category_confusion;  I totally agree that the widespread of modern tecnology can effect on number of healt problems.; the widespread of modern tecnology; the widespread modern technology
http://realec.org/index.xhtml#/exam/exam2017_7/VSa_87_1; Category_confusion; 
The selling of eBooks in 2014 in such countries like Germany and China are less comparing to USA.; comparing; 
http://realec.org/index.xhtml#/exam/exam2017_7/VSa_87_1; Category_confusion; 
The markets of eBook and print book are to remain stable, while USA will have a rapid increase in selling in 2018.; selling; 
http://realec.org/index.xhtml#/exam/exam2017_7/VSa_87_1; Category_confusion;  Meanwhile the markets in the UK will have steady decreasing in selling eBooks and steady increasing in selling print.; decreasing; 
http://realec.org/index.xhtml#/exam/exam2017_7/VSa_87_1; Category_confusion;  Meanwhile the markets in the UK will have steady decreasing in selling eBooks and steady increasing in selling print.; increasing; increace
http://realec.org/index.xhtml#/exam/exam2017_7/OBy_200_1; Category_confusion;  

Looking at the charts in more details, we can see that manufactured goods are transported both by rail and by road with the percentage of 25% and 28%.; in more details; more detaily
http://realec.org/index.xhtml#/exam/exam2017_7/VSa_45_2; Category_confusion; Majority of people believe that an active using of different types of technology can have bad influence on human's health.; using; use
http://realec.org/index.xhtml#/exam/exam2017_7/VSa_45_2; Category_confusion;  This essay will discuss this controversial topic by taking into account firstly, health problems, which is causing by technology and secondly, it will give a solution of this issue.; firstly; first
http://realec.org/index.xhtml#/exam/exam2017_7/VSa_45_2; Category_confusion;  Moreover, Modern technology makes our lifestyle more setendary than several decades ago, but sitting is bad for us, due to it can be a cause of overweight, problems with breath and brain activity and death.; breath; breathing
