http://realec.org/index.xhtml#/exam/exam2017_1/ABl_9_1; Category_confusion;  The biggest dinamic of rate of people, who can not find a job happened in Middle East and the difference between 2014 and 2015 year was 1,4%.; dinamic; dynamics
http://realec.org/index.xhtml#/exam/exam2017_1/ABl_9_1; Category_confusion; 
There is no one main trend of changing of unemployment rate in all regions during the selected period (2014-2015).; changing of; changes in
http://realec.org/index.xhtml#/exam/exam2017_1/ABl_9_2; Category_confusion;  Secondary, investors are not interested in activities, where they pay a huge amounts of money and other people just “steal” their production and money.; Secondary; Secondly
http://realec.org/index.xhtml#/exam/exam2017_1/ABl_9_2; Category_confusion;  Investors prefer to avoied such spheras where pirates can use special programmes and steal everything so easy.; easy; easily
http://realec.org/index.xhtml#/exam/exam2017_1/ABl_8_2; Category_confusion; 
The first part of peoples says that punishment is necessory for pirates.; punishment; punishing
http://realec.org/index.xhtml#/exam/exam2017_1/ABl_8_1; Category_confusion;  In Middle East and Latin America we see the decreasing of unemployment for 1,4 per cent in the first case and for 1 per cent in Latin America case.; decreasing; decrease
http://realec.org/index.xhtml#/exam/exam2017_1/ABl_8_1; Category_confusion;  When we indicate the increasing of unemployment is EU: unemployment increase for 0,4 per cent here.; increasing; increase
http://realec.org/index.xhtml#/exam/exam2017_1/ABl_8_1; Category_confusion;  But in 2014 unemployment in Latin America was higher then Worldwide level, and the next year this region have approximately the same per cent.; per cent; percentage
http://realec.org/index.xhtml#/exam/exam2017_1/ABl_6_2; Category_confusion;  However, it seem to me that in the nearest future all information will be accessed for free without punishing people who want to be free-riders.; accessed; accessible
http://realec.org/index.xhtml#/exam/exam2017_1/ABl_12_2; Category_confusion;  In this way, the musicians and film producers should make qualitative content.; qualitative; quality
http://realec.org/index.xhtml#/exam/exam2017_1/ABl_4_1; Category_confusion; 
The middle east shows the dicreasing of unemployment rate from 11 to 9,6 procent.; dicreasing of; decrease in
http://realec.org/index.xhtml#/exam/exam2017_1/ABl_4_1; Category_confusion;  On the other hand, latin America demonstrated significant changing from 6,8 to 5,8 procent.; changing; changes
http://realec.org/index.xhtml#/exam/exam2017_1/ABl_10_2; Category_confusion;  Secondly, it is bad for the governments economies because the illegal spreading of that content cannot be taxated.; taxated; taxed
http://realec.org/index.xhtml#/exam/exam2017_1/ABl_10_2; Category_confusion;  Some people think that every person in the world should be able to find all the content he or her needs for free.; her; she
http://realec.org/index.xhtml#/exam/exam2017_1/ABl_12_1; Category_confusion;  To the other regions the percentage of unemployment is erratic.; unemployment; the unemployed
http://realec.org/index.xhtml#/exam/exam2017_1/ABl_4_2; Category_confusion;  They spend money for this and after that they do sharing for free.; do sharing; share the content
http://realec.org/index.xhtml#/exam/exam2017_1/ABl_2_1; Category_confusion; The bar chart shows the difference in dynamics of changing in unemployment across several world regions in 2014 and 2015.; changing; changes
http://realec.org/index.xhtml#/exam/exam2017_1/ABl_2_2; Category_confusion; 
Secondly, modern market moves in the direction of micro transactions, instead of simple selling the product.; simple; simply
http://realec.org/index.xhtml#/exam/exam2017_1/ABl_2_2; Category_confusion; 
Taking everything into consideration, my disagreement with the punishing of the people, who copying and sharing music or films illegally, can be explained by the influence of the Internet on the modern market system.; punishing; punishment
http://realec.org/index.xhtml#/exam/exam2017_1/ABl_14_1; Category_confusion;  The highest changing in the rate of unemployment shows Middle East with 1,4 reduction of the rate.; changing; change
http://realec.org/index.xhtml#/exam/exam2017_1/ABl_14_1; Category_confusion;  Also Latin America demonstrate positive changing in the rate of unemployment during that period with 1 procent down.; changing; changes
http://realec.org/index.xhtml#/exam/exam2017_1/ABl_14_1; Category_confusion;  Only in the European Union the rising of the rate of unemployment was captured during that period of time.; the rising of the rate of unemployment; the rise of the rate of unemployment
http://realec.org/index.xhtml#/exam/exam2017_1/ABl_7_1; Category_confusion;  There is a positive trend in decreasing the unemployment from 11% in 2014 to 9,6 on 2015.; decreasing; a decrease in
http://realec.org/index.xhtml#/exam/exam2017_1/ABl_7_1; Category_confusion;  Although this level is still not quite , comparing to previous ones.; comparing; compared
http://realec.org/index.xhtml#/exam/exam2017_1/ABl_5_2; Category_confusion;  Secondly, pirate copies usually have bad quality and viruses inside them, which can lead to breakaning computers and stealing money and personal information.; breakaning; breakdown of
http://realec.org/index.xhtml#/exam/exam2017_1/ABl_7_2; Category_confusion;  In second case, consumer doesn’t get any commercial profit from using the pirate content, so it could not be called a criminality, because the aim of such use is not a violating of property rights, but just baring enjoyment from the piece of art.; criminality; crime
http://realec.org/index.xhtml#/exam/exam2017_1/ABl_7_2; Category_confusion;  In second case, consumer doesn’t get any commercial profit from using the pirate content, so it could not be called a criminality, because the aim of such use is not a violating of property rights, but just baring enjoyment from the piece of art.; a violating of; violating 
http://realec.org/index.xhtml#/exam/exam2017_1/ABl_5_1; Category_confusion;  For example, the unemployment rate in Middle East dropped down from 11 to 3,6 percent while EU experienced the growing of unemployment rate from 7,5 to 7,9 percent when can be considered as outcomes of some not relevant economic decisions.; the growing; the growth
http://realec.org/index.xhtml#/exam/exam2017_1/ABl_3_2; Category_confusion; 
It can be agreed with the statement about getting punishment both for hackers and people using pirat’s copies.; pirat; pirate
http://realec.org/index.xhtml#/exam/exam2017_1/ABl_3_2; Category_confusion;  Beside this, people often don’t want to buy expensive legal discs and films and that is why they download pirat’s versions because of a special aim not to spend a lot of money for these media products.; pirat; pirate
http://realec.org/index.xhtml#/exam/exam2017_1/ABl_3_2; Category_confusion;  Moreover, there is tend to share of musical products in the Internet with friends and relatives.; tend; a tendency
http://realec.org/index.xhtml#/exam/exam2017_1/ABl_3_2; Category_confusion; 
In conclusion I want to say that, of courses, all crime-makers should be punished especially how in situation that pirat’s copies are world-spread.; pirat; pirate
http://realec.org/index.xhtml#/exam/exam2017_1/ABl_3_2; Category_confusion;  Beside this, people often don’t want to buy expensive legal discs and films and that is why they download pirat’s versions because of a special aim not to spend a lot of money for these media products.; Beside; Besides
http://realec.org/index.xhtml#/exam/exam2017_1/ABL_1_2; Category_confusion; The issue of “content pirates” is the huge problem for modern ethics and law.; pirates; content piracy
http://realec.org/index.xhtml#/exam/exam2017_1/ABL_1_2; Category_confusion;  The attitude to sharing information in XXI century may be under influence of different points of view.; under influence of; influenced by
http://realec.org/index.xhtml#/exam/exam2017_1/ABL_1_2; Category_confusion;  As usual, the producers say “no”.; As usual; Usually
http://realec.org/index.xhtml#/exam/exam2017_1/ABl_15_2; Category_confusion;  
On the one hand it is a really problem, because people always download music and films free for a long time.; really; real
http://realec.org/index.xhtml#/exam/exam2017_1/ABl_15_2; Category_confusion;  There are a lot of new films and some people have not money to buy it.; not; no
http://realec.org/index.xhtml#/exam/exam2017_1/ABl_15_2; Category_confusion; 
It is likely to think for people that free music and films in the internet is a better way than buy it.; buy; buying
http://realec.org/index.xhtml#/exam/exam2017_1/ABl_3_1; Category_confusion; 
In the table there are 5 world regions which were used for measuring of unemployment.; measuring of; was measured
http://realec.org/index.xhtml#/exam/exam2017_1/ABl_3_1; Category_confusion;  The high of every vertical stable helps us to compare marcs for 2014 and 2015.; high; height
http://realec.org/index.xhtml#/exam/exam2017_1/ABl_3_1; Category_confusion;  Every region shows increasing or the same level of unemployment excepting Europe.; excepting; except
http://realec.org/index.xhtml#/exam/exam2017_1/ABl_3_1; Category_confusion;  That mean we see stable situation in the world and there are no reasons for concerning.; concerning; concern
http://realec.org/index.xhtml#/exam/exam2017_1/ABl_3_1; Category_confusion;  But EU stable gives another effect.; EU stable; stability of the EU
http://realec.org/index.xhtml#/exam/exam2017_2/ABl_47_1; Category_confusion; The chart show amount of unemployment people from 2014 to 2015 in N.; unemployment; unemployed
http://realec.org/index.xhtml#/exam/exam2017_2/ABl_47_1; Category_confusion;  In the such development region as Europe there are a level of unemployments was put up, on 0,4 persent but it is not a critical situation, because of it is nearly by worldwide rate which is 5,9%.; development; developed
http://realec.org/index.xhtml#/exam/exam2017_2/ABl_47_1; Category_confusion;  Based on the information, providing by this chart, situation of law lever could be seen in developed countries in EU, S.; providing; provided
http://realec.org/index.xhtml#/exam/exam2017_2/ABl_19_2; Category_confusion;  Secondly, intellectual property is protected by the law and everyone who doesn’t follow the judiciary system’s rules should be punished.; judiciary system; judicial system
http://realec.org/index.xhtml#/exam/exam2017_2/ABl_45_2; Category_confusion; 
To sum up, the society is divided on two sections about this issue: the first one says that downloading things freely shouldn’t be charged bad, however, the second one argues that it is amoral and illegal and it should be punished.; bad; badly
http://realec.org/index.xhtml#/exam/exam2017_2/ABl_47_2; Category_confusion;  I agree, with this statement, that nowadays such actions as download pirate copies should be punished.; download; downloading
http://realec.org/index.xhtml#/exam/exam2017_2/ABl_47_2; Category_confusion;  No one want to get nothing for time, brain power which were using for creation something new.; creation; create
http://realec.org/index.xhtml#/exam/exam2017_2/ABl_26_2; Category_confusion; 
To summarize, there some somewhat strong arguments to the punishment of law violators.; the punishment of law violators; punishing law violators
http://realec.org/index.xhtml#/exam/exam2017_2/ABl_26_2; Category_confusion;  That would be a huge pity and a loss-loss situation.; loss-loss situation; lose-lose situation
http://realec.org/index.xhtml#/exam/exam2017_2/ABl_45_1; Category_confusion;  Suprisingly, we can see the growing of unemployment in the European Union.; growing; growth
http://realec.org/index.xhtml#/exam/exam2017_2/ABl_45_1; Category_confusion;  However, the minuses are the stability of high unemployment in one of the poorest regions in the world – North Africa and the growing unemployment in different countries.; growing; growth
http://realec.org/index.xhtml#/exam/exam2017_2/ABl_39_1; Category_confusion; 
First, we can see differences between two years – from 2014 to 2015 the unemployment rate decreased, but slightly and not everywhere.; First; Firstly
http://realec.org/index.xhtml#/exam/exam2017_2/ABl_39_1; Category_confusion;  Second, it is need to say that the world wide unemployment rate, as we see didn’t grow or declay.; Second; Secondly
http://realec.org/index.xhtml#/exam/exam2017_2/ABl_39_1; Category_confusion;  Changes from no one year (2014) to another (2015) are not dramatically and in some region we even see the same results (12,5% in N.; dramatically; dramatic
http://realec.org/index.xhtml#/exam/exam2017_2/ABl_22_2; Category_confusion;  There are two different points of illegal downloading films or music and importance of punishment for them.; illegal downloading films or music; downloading films or music illegally
http://realec.org/index.xhtml#/exam/exam2017_2/ABl_22_2; Category_confusion;  In consequences they lose a lot of money from illegal pirate copies.; In consequences; Consequently
http://realec.org/index.xhtml#/exam/exam2017_2/ABl_22_2; Category_confusion;  In this situation people don’t have any opportunities for buying original disk.; buying; buy
http://realec.org/index.xhtml#/exam/exam2017_2/ABl_22_2; Category_confusion;  In result, it can be seen that we have demand on music/film from poor people and we have supply on free download all what you want in the Internet.; download; downloading
http://realec.org/index.xhtml#/exam/exam2017_2/ABl_22_2; Category_confusion;  Also, in my view, I absolute disagree with punishing for people who don’t have any opportunities for buying original disk.; absolute; absolutely
http://realec.org/index.xhtml#/exam/exam2017_2/ABl_22_2; Category_confusion;  Also, in my view, I absolute disagree with punishing for people who don’t have any opportunities for buying original disk.; buying; 
http://realec.org/index.xhtml#/exam/exam2017_2/ABl_43_2; Category_confusion;  It has resulted in losing money for musicians and film producers.; losing money; money losses
http://realec.org/index.xhtml#/exam/exam2017_2/ABl_43_2; Category_confusion; 
On the one hand, the intellectual property should be secured like other kinds of private property the desire of getting money for their work is absolutely moral.; getting; get
http://realec.org/index.xhtml#/exam/exam2017_2/ABl_43_2; Category_confusion; 
I agree that the break of copyright is crime.; the break of; breaking
http://realec.org/index.xhtml#/exam/exam2017_2/ABl_43_2; Category_confusion;  But I tend to feel that punishment for users is very cruel idea.; punishment for; punishing
http://realec.org/index.xhtml#/exam/exam2017_2/ABl_20_1; Category_confusion;  Latin America region shows better tendecy decreasing unemployment from 6,8 to 5,8.; decreasing; a decrease
http://realec.org/index.xhtml#/exam/exam2017_2/ABl_20_1; Category_confusion;  The worldwide trend show  equal data in comprasion in 2014 and 2015.; in comprasion in ; comparing 
http://realec.org/index.xhtml#/exam/exam2017_2/ABl_20_1; Category_confusion;  In comprasion between the EU and Latin America.; In comprasion between; Comparing
http://realec.org/index.xhtml#/exam/exam2017_2/ABl_39_2; Category_confusion;  Second, some people have no chance to pay for useful content.; Second; Secondly
http://realec.org/index.xhtml#/exam/exam2017_2/ABl_39_2; Category_confusion;  And third, there are a lot of ways to make money for musicians, filmmakers and authors.; third; thirdly
http://realec.org/index.xhtml#/exam/exam2017_2/ABl_41_2; Category_confusion;  If the state would have taken more actions in these aspects, we, just, couldn’t have found these files which would have lead to buying license disks because this would have been the only source.; license; licensed
http://realec.org/index.xhtml#/exam/exam2017_2/ABl_22_1; Category_confusion;  In general it can be seen that unemployment rate had slightly changes in different world regions.; slightly; slight
http://realec.org/index.xhtml#/exam/exam2017_2/ABl_20_2; Category_confusion;  The first reason for it, that companies lost their profit and can lost a motivation to create a quality product, which can be produce in the market.; quality; qualitative
http://realec.org/index.xhtml#/exam/exam2017_2/ABl_20_2; Category_confusion;  because it is if the part of film will be download before the day of premier, the rang of company dramatic decrease.; dramatic; dramatically
http://realec.org/index.xhtml#/exam/exam2017_2/ABl_43_1; Category_confusion;  Meanwhile, in neighbour region the Middle East this figures declined from 11% in 2014 to 9,6% in 2015.; neighbour; neighbouring
http://realec.org/index.xhtml#/exam/exam2017_2/ABl_46_2; Category_confusion;  And in this model, internet is a factor which blocks a huge amount of sales because some part of films and music auditory prefers to get this content for free and forgets about payment to creators.; payment to; paying
http://realec.org/index.xhtml#/exam/exam2017_2/ABl_25_1; Category_confusion;  In the Northern Africa we can see similar high level of unemployment rate on level 12,5 point in both of comparing years.; similar; similarly
http://realec.org/index.xhtml#/exam/exam2017_2/ABl_25_1; Category_confusion;  In the Northern Africa we can see similar high level of unemployment rate on level 12,5 point in both of comparing years.; comparing; compared
http://realec.org/index.xhtml#/exam/exam2017_2/ABl_25_1; Category_confusion;  This situation we can named usual in own days, and can be discribing it a stability with rising in European union from “Brexet” and immigration crisies.; discribing; described
http://realec.org/index.xhtml#/exam/exam2017_2/ABl_27_2; Category_confusion; In fact pirate copies led to different producers lose their benefits every year.; lose; losses
http://realec.org/index.xhtml#/exam/exam2017_2/ABl_27_2; Category_confusion; 
To sum up, punishmend for pirate copies should be in the state to provide authors’ rights, but in my oppinion they should not be very strict.; in the state; stated
http://realec.org/index.xhtml#/exam/exam2017_2/ABl_25_2; Category_confusion;  However, torrents it’s a good opportunity for poor people watching new films and listening beautiful music.; watching; to watch
http://realec.org/index.xhtml#/exam/exam2017_2/ABl_25_2; Category_confusion;  However, torrents it’s a good opportunity for poor people watching new films and listening beautiful music.; listening; listen
http://realec.org/index.xhtml#/exam/exam2017_2/ABl_25_2; Category_confusion;  Without these money, this companiy can’t make a quality new products.; quality; qualitative
http://realec.org/index.xhtml#/exam/exam2017_2/ABl_25_2; Category_confusion;  A good example is a “Metro Golden Mayer” which loss more than 3,5 billions dollars from 2008 year.; loss; lost
http://realec.org/index.xhtml#/exam/exam2017_2/ABl_44_2; Category_confusion; A lot of artists and entertainment organisations have financional costs because of free using of their contents in the Internet.; entertainment; entertaining
http://realec.org/index.xhtml#/exam/exam2017_2/ABl_40_2; Category_confusion; 
The critics of punishment speak about the disability of comparison the crime like steeling something and pirate copying: the rate is the same.; comparison; comparing
http://realec.org/index.xhtml#/exam/exam2017_2/ABl_21_2; Category_confusion;  It will lead to growing of cashflow to dealers too.; growing; a growth
http://realec.org/index.xhtml#/exam/exam2017_2/ABl_42_2; Category_confusion;  We may become emotionally fulfill and we may get a very profound knowledge of who are we and where are we going.; fulfill; fulfilled
http://realec.org/index.xhtml#/exam/exam2017_2/ABl_42_2; Category_confusion;  And Internet, free sharing, pirates – all mentioned allows creators directly communicate with their potential (and non-potential) authority, with those who could understand them.; sharing; share
http://realec.org/index.xhtml#/exam/exam2017_2/ABl_21_1; Category_confusion;  There is a massive gap from 2014 to 2015 in Middle East, it is 1,4%, so the trend is disceasing of unemployment level.; disceasing; a decrease
http://realec.org/index.xhtml#/exam/exam2017_2/ABl_36_2; Category_confusion;  With help of social networks and web-sites people all around the world could copy films and music and watch or hear it illegal.; illegal; illegally
http://realec.org/index.xhtml#/exam/exam2017_2/ABl_34_1; Category_confusion;  Only the European Union had a trend of rate’s rising.; rising; rise
http://realec.org/index.xhtml#/exam/exam2017_2/ABl_30_2; Category_confusion; 
The opposition of mentioned point of view says that all high-qualified goods must be payed.; high-qualified; high quality
http://realec.org/index.xhtml#/exam/exam2017_2/ABl_48_2; Category_confusion; 
In addition, many experts claim that it is hard to stop and control the process of making copies and how many people download them.; download; downloading
http://realec.org/index.xhtml#/exam/exam2017_2/ABl_48_2; Category_confusion;  It will lead to decreasing of revenue for film producers and film companies.; decreasing; decrease
http://realec.org/index.xhtml#/exam/exam2017_2/ABl_48_2; Category_confusion;  The results show, that the most important field of economic were selling of pop-corn and Coca-Cola.; selling; the sales
http://realec.org/index.xhtml#/exam/exam2017_2/ABl_29_2; Category_confusion;  Some people said that there would be much more art, films and music if everyone honest support creaters and buy legal cop.; honest; honestly
http://realec.org/index.xhtml#/exam/exam2017_2/ABl_32_1; Category_confusion;  As for EU, the rate slight increased in 2015 and it is nearly 8 percent.; slight; slightly
http://realec.org/index.xhtml#/exam/exam2017_2/ABl_29_1; Category_confusion;  There is not any dawnward or rising.; rising; rise
http://realec.org/index.xhtml#/exam/exam2017_2/ABl_32_2; Category_confusion; 
However, some people think that it is normally situation in the modern life and musicians and film producers should understand, that they can’t evide loosing goods.; normally; normal
http://realec.org/index.xhtml#/exam/exam2017_2/ABl_37_2; Category_confusion;  Also, They usually say that pirating damges incomes of musicians and filmmakers, so they worry others about the situation that the worldwide music and film industry becomes less productive and more dependent of government (which affects the quality of all types of art).; pirating; piracy
http://realec.org/index.xhtml#/exam/exam2017_2/ABl_37_2; Category_confusion; 
The second group of people which support pirating usually refers to the idea of “free intelectual belongings”.; pirating; piracy
http://realec.org/index.xhtml#/exam/exam2017_2/ABl_31_1; Category_confusion; The chart compare changes in rate of unemployment people in selected regions of world between 2014 and 2015.; unemployment; unemployed
http://realec.org/index.xhtml#/exam/exam2017_2/ABl_31_1; Category_confusion;  EU had small change in unemployment – only 0,4 persent rise in percentage of unemployment people.; unemployment; unemployed
http://realec.org/index.xhtml#/exam/exam2017_2/ABl_31_1; Category_confusion;  The smallest percentage of unemployment citizens had South Asia with 3,9 percent.; unemployment; unemployed
http://realec.org/index.xhtml#/exam/exam2017_2/ABl_31_1; Category_confusion; 
Overall, situation with unemployment people didn’t significantly change in the worldwide.; unemployment; unemployed
http://realec.org/index.xhtml#/exam/exam2017_2/ABl_17_2; Category_confusion;  First, there are usually fixed amounts of money a person is ready to spend on different kinds of entertainments.; First; Firstly
http://realec.org/index.xhtml#/exam/exam2017_2/ABl_17_2; Category_confusion;  Second, film makers now earn fantastic amounts of money by demonstrating their films in cinemas, and what about musicians, their main source of income is their concerts.; Second; Secondly
http://realec.org/index.xhtml#/exam/exam2017_2/ABl_17_2; Category_confusion;  Third, if ordinary people are punished for piracy, their dissatisfaction will be much higher than dissatisfaction of authors, whose intellectual property is stolen.; Third; Thirdly
http://realec.org/index.xhtml#/exam/exam2017_2/ABl_17_2; Category_confusion;  What is more, people will get used to respect intellectual property, what can be really beneficial for development of society.; respect; respecting
http://realec.org/index.xhtml#/exam/exam2017_2/ABl_50_1; Category_confusion; 
To sum up it is important to see that development countries shows the situation when the level of unemployment do not grow up.; development; developed
http://realec.org/index.xhtml#/exam/exam2017_2/ABl_50_1; Category_confusion;  However, two regions mono to the situation of decreasing of unemployment.; decreasing; a decrease
http://realec.org/index.xhtml#/exam/exam2017_2/ABl_28_1; Category_confusion;  European Union’s chart shows that the percentage of unemployment people has increased from 7,5 to 7,9.; unemployment people; unemployed people
http://realec.org/index.xhtml#/exam/exam2017_2/ABl_49_2; Category_confusion; 
Secondly, it’s obviously, that every work should be paid off.; obviously; obvious
http://realec.org/index.xhtml#/exam/exam2017_2/ABl_50_2; Category_confusion;  There is no any necessary to download pirate aspects of legal content said au making comfort in the modern world.; necessary; necessity
http://realec.org/index.xhtml#/exam/exam2017_2/ABl_50_2; Category_confusion;  In this way this choice of avoid the payment of content should be punished.; the payment; paying
http://realec.org/index.xhtml#/exam/exam2017_2/ABl_28_2; Category_confusion; 
